Posição,Usuário,Data,Link,Legenda,Decupagem
Oposição,Eduardo Girão,22 de jun.,https://www.instagram.com/reel/Ct0IeCBrbGV/,"🗣️CAI + UMA NARRATIVA DO GOV.LUL4: NÃO HÁ ELO ENTRE O AT3NT4D0 DO AEROPORTO C/ ATOS DE 8/1…👈🏾

Sai há pouco do senadofederal após cerca de 10 horas de depoimentos da CPMI dos atos de 8/1. Fiquei do começo ao fim. 

Procurei entender o que aconteceu, de fato, na véspera de Natal no aeroporto de Brasília a partir de uma preparação de 4T3NT4D0 que quase causa uma tragédia sem precedentes na história do País. 

Selecionei aqui um trecho de minhas perguntas ao delegado e perito. 

Em nosso canal do Y0U TUB3 você encontrará todas as minhas participações na íntegra, inclusive as perguntas ao Sr George Washington envolvido diretamente no caso. 

Ficou claro que não houve relação alguma entre o caso gravíssimo do aeroporto com o da esplanada dos ministérios e caiu mais uma narrativa ideológica. Parte da imprensa e o Governo LUL4 insistem em classificar os atos de 8 de janeiro como tendo sido terr0r1stas mas, se a própria equipe da Polícia do GDF diz que o ato que eu classifico como sendo um atent4d0 (tentativa de EXPL0D1R um caminhão tanque no aeroporto) não pode ser assim classificado que dirá o do 8/1…

A CPMI, mesmo sob maioria do GOV. LUL4 que capturou esse instrumento legitimo da oposição, vem conseguindo desmontar as narrativas e discursos falaciosos que por aí correm.

Que a verdade é a Justiça prevaleçam. 
Jesus no comando. Sempre!
Paz & Bem 👍🇧🇷☀️🙏🏽

#senadoreduardogirão #éticanapolítica #pelobrasil #peloceará #justiçaparatodos #cpmi #deusnocontrole","<Imagens do parlamentar falando na CPM. Quando o interlocutor fala, a imagem dele aparece momentâneamente>

(Eduardo Girão) A gente aprende numa situação dessa, que é uma coisa quase que de filme hollywoodiano. É preocupante isso acontecer no Brasil. Mas nós percebemos que a intenção está muito clara, a intenção era explodir mesmo. Ainda bem, graças a Deus, que faltou competência. Foi essa a dedução que eu fiz aqui, que graças a Deus isso não aconteceu.

(Eduardo Girão) Mas eu quero fazer aqui umas considerações importantes, porque não é de hoje, e que isso sirva de alerta, senador Marcos Rogério, não é de hoje que isso tem acontecido no nosso país, que está tomado pelo crime organizado, que além do tráfico de drogas, assaltos, assassinatos, também está investindo contra a população em atos terroristas. Sim, terroristas.

(Eduardo Girão) Em dezembro de 2018, uma facção criminosa planejava implantar o terror em Brasília com ataques à ônibus e assassinatos de agentes prisionais. No meu estado, Ceará, durante quase todo o mês de janeiro de 2019, o crime organizado aterrorizou mais de 50 cidades. Nesse período, foram colocados explosivos em pontes, viadutos, ônibus foram incendiados, prédios públicos, agentes de segurança foram atacados.

(Eduardo Girão) Na sua vivência como policial, certamente, doutor Leonardo de Castro, delegado, o senhor deve ter vivido inúmeras experiências que poderiam ser definidas como terrorismo. Eu lhe pergunto, diante da pluralidade do material, armas e artefatos explosivos apreendidos com o senhor Jorge Washington, que demonstram uma estratégia bem definida, o senhor encaixaria esse ato como ação de profissionais?

(Leonardo de Castro) Como já foi respondido, no sentido legal, esse ato não se enquadra como terrorismo. E, pelo que foi apurado, a gente observa até pela ineficiência do artefato que não foram atos cometidos por profissionais. Agora, o que a gente não pode excluir é que são fatos gravíssimos e que realmente, se tivessem sido concretizados, a gente estaria hoje falando aqui provavelmente de mortes.

(Eduardo Girão) Tá, pegando essa analogia com a sua experiência, eu lhe pergunto, quanto à invasão, deplorável sim, que houve aqui nos prédios públicos, na Praça dos Três Poderes, no dia 8 de janeiro, o senhor definiria isso como ato terrorista? Se sim, eu peço o senhor que explique.

(Leonardo de Castro) Com a devida vênia, excelência, eu não estou aqui para emitir minha opinião. Estou aqui para relatar fatos, para depor sobre fatos investigados. Então eu prefiro me abster de responder essa pergunta e de dar minha opinião pessoal.
"
Oposição,Marcos Rogério,22 de jun.,https://www.instagram.com/reel/Ctz_Uvev469/,"O governo faz um verdadeiro teatro na tentativa de construir narrativas sobre o que de fato aconteceu no dia 08/01. Uma retórica usada para tentar incriminar os manifestantes que pacificamente protestavam em frente ao QG, em Brasília. 

É inacreditável!","<Montagem com vídeo do parlamentar falando na CPMI. Acima um texto em destaque ""É hora de separar o joio do trigo"">

É preciso afastar as narrativas. É preciso afastar as ilações que o grupo do atual governo tenta impor no âmbito dessa CPI.

O senhor Jorge vem aqui e traz algumas informações que demonstram absolutamente a desvinculação do ato do dia 24 com o ato do dia 8. O governo vem aqui e diz, ""não, está vinculado"". 

O governo vem aqui e faz um teatro em cima daquilo que está saindo, por exemplo, das mensagens, das interceptações que foram colhidas do celular do senhor Mauro Cid.

Essas revelações que estão apresentando, que estão sendo apresentadas até agora, elas trazem apenas uma única evidência. Uma única evidência parte do celular do senhor Mauro Cid, até agora:  de que o presidente Bolsonaro em nenhum momento participou, articulou ou autorizou qualquer ato atentatório à democracia do Brasil.

Veja, a narrativa do governo é dizer que aquilo lá revela um plano de golpe. Mas quando você olha para o conteúdo das mensagens, o que você identifica, na verdade, é a defesa clara e cristalina do presidente Bolsonaro. Ele nunca participou disso.

Obviamente que pessoas que não queriam, não desejavam e que às vezes até acreditavam na possibilidade de um sistema eleitoral induzido à fraude, tenha alimentado algum tipo de expectativa e tenha se manifestado nesse sentido. Mas quando você vai olhar para os fatos, para as evidências, para as provas, você não vê um único ato do ex-presidente Bolsonaro tramando, orquestrando, auxiliando, determinando qualquer coisa dessa natureza.

Lamento que pessoas inocentes continuem presas e espero que as autoridades de plantão possam ter a consciência de que é necessário, Sr. Presidente, eu acho que esse é o papel também desta CPI, de separar culpados de inocentes.
"
Oposição,Marcos Rogério,22 de jun.,https://www.instagram.com/reel/CtzjUj_NTdS/,"Hoje, na CPMI de 8/1, ficou claro de que os atos terroristas que ocorreram em Brasília foram praticados por indivíduos que agiram de forma isolada. Não foi uma ação coordenada, como tenta vender a esquerda, pelos manifestantes acampados no QG. É preciso separar o joio do trigo!","<Parlamentar falando na CPMI durante oitava de representantes da PF> 

(Marcos Rogério) Pergunto ao delegado doutor Leonardo. É possível afirmar que fabricação, instalação e detonação do artefato ou a preparação para, era parte de um plano coletivo daqueles que estavam no acampamento ou era uma ação isolada desses que foram identificados?

(Delegado Leonardo) Está comprovado a participação desses três indivíduos. E os indícios indicam, apontam, para a participação de mais alguns, pelo menos cinco outros indivíduos. Isso desde o início e para isso foi instaurado um novo inquérito.

(Marcos Rogério) Eu vou além da pergunta nesse ponto. Quantas pessoas foram ouvidas nesta investigação sendo elas daquelas que estavam no acampamento?

(Delegado Leonardo) Apenas os dois presos foram ouvidos.

(Marcos Rogério) Apenas os dois presos?

(Delegado Leonardo) Sim, nessa primeira investigação.

(Marcos Rogério) Então, o que tem aqui é apenas a versão desse cidadão condenado.

(Delegado Leonardo) Com relação à oitiva, sim.

(Marcos Rogério) Não houve...

(Delegado Leonardo) Outros elementos indicam a participação de outras pessoas que estão sendo apuradas no novo inquérito.

(Marcos Rogério) É possível afirmar que quem estava no QG tinha conhecimento do plano de ataque à bomba, participou dele, direto ou indiretamente?

(Delegado Leonardo) Os fatos que foram apresentados para o DECOR, para a investigação, nós investigamos que foi a colocação da bomba e nisso foram acostados aos altos algumas informações com relação ao planejamento que nós estamos apurando. Mas não foi alvo de investigação do DECOR o acampamento ou qualquer planejamento de outro ato.

(Marcos Rogério) Estou fazendo essas perguntas com relação aos demais pontos, porque a todo tempo tentam deslegitimar movimentos, que são movimentos legítimos, pinçando situações pontuais.

(Marcos Rogério) No passado nós tivemos situações análogas. O impeachment de Dilma aconteceu depois de manifestações que começaram no Rio Grande do Sul com o Vem Pra Rua. E nós tivemos no meio desses atos uma parcela, chamada de Black Blocs, que era do quebra-tudo. Mas deslegitimou o ato dos demais que faziam manifestações pacíficas? Não.

(Marcos Rogério) O que nós precisamos separar aqui é quem é criminoso de quem não é.
"
Oposição,Marco Feliciano,22 de jun.,https://www.instagram.com/reel/Ct0Kk2dx7xo/,Máquina de destruição de reputações - CPMI dos atos de 8 de janeiro.,"<Parlamentar falando na CPMI. Quando há interlocutores, a câmera mostra os interlocutores, agentes da Polícia Federal>

(Marco Feliciano) Sobre os assuntos de hoje, eu queria aqui fazer perguntas simples.

(Marco Feliciano) Sr. Renato, houve qualquer movimento dos autores da tentativa de explosão da bomba, através do estudo que o senhor fez, para que eles pudessem, de alguma forma, desarmar o explosivo?

(Renato) Não, eu não encontrei nenhum vestígio que indicasse nesse sentido.

(Marco Feliciano) Segunda pergunta, o senhor teve algum contato com as pessoas que foram acusadas, Jorge Washington, o Alain, houve contato físico com o senhor?

(Renato) Não senhor, só para esclarecer essa parte da investigação das prisões, é coordenada e feita pelo delegado de polícia e a nossa parte pericial fica com os vestígios materiais. E nesse caso especificamente eu não tive contato direto com nenhum dos acusados.

(Marco Feliciano) Muito obrigado.

(Marco Feliciano) Há uma máquina de destruição de reputações no nosso país e ela começa talvez por conta da política.

(Marco Feliciano) Todos nós sabemos que o impeachment ou uma CPI são instrumentos constitucionais, mas a natureza deles, e a natureza é política, e associar pessoas a políticos para destruir as suas imagens chega a ser até cruel.

(Marco Feliciano) Se não me falo da memória, e eu apelo aqui ao meu querido irmão Marcos Rogério, que é o nosso intelectual em plantão, se não me falo da memória, foi Clausewitz que disse que a política é a continuação da guerra por outros meios. Antigamente, as pessoas, quando brigavam, as nações brigavam, as aldeias brigavam, iam até o derramamento de sangue, às vezes, de fato. Então, o homem civilizado moderno, criou a política. Então, Clausewitz disse que a política é a continuação da guerra por outros meios.

(Marco Feliciano) Não é justo você sofrer por uma coisa que você não fez.

(Marco Feliciano) Tudo que eu vejo aqui até esse momento é ação de lobos solitários. Lobos solitários que já estão sendo punidos, graças a Deus. Bandido tem que ficar atrás das grades. Pessoas que colocam a população em risco, crianças, mulheres, a estabilidade de uma cidade, de um país todo, tem que ficar atrás das grades. O que não pode ser feito é a injustiça de tentar associar essa pessoa ao presidente Bolsonaro, por exemplo.

(Marco Feliciano) Eu já sofri na pele tal injustiça. Eu e alguns amigos que estamos aqui. O país ficou paralisado ano passado com uma deputada que matou o marido. E aí a imprensa toda, inclusive já existem filmes sobre isso, e fazem questão, os cineastas, a grande imprensa e aqueles que são nossos algozes, em colocar a nossa imagem ao lado da pessoa,  como se nós tivéssemos culpa de em algum momento da vida termos estado ao lado da pessoa. Eu preguei num evento lá no Rio de Janeiro por 11 anos, que era liderado pela Flor de Lis e pelo Anderson. Eu frequentava a casa dos dois, eram amigos. Pegou todo mundo de surpresa. Mas a imprensa e os nossos inimigos pegam a imagem assim, olha de quem era um amigo.

(Marco Feliciano) Eu sou pastor de igreja, igreja trabalha com recuperação de pessoas. Um belo dia eu estou na minha cidade, saio no jornal da cidade, membro da igreja do pastor Feliciano, matou o pai e a mãe. Que culpa tenho eu que o membro matou o pai e a mãe? O que foi que eu fiz? Estender a mão para essas pessoas? Mas a notícia falada e a forma como se é exposto é para destruir a imagem daqueles que as pessoas não amam. Isso, então, é injusto.

(Marco Feliciano) O que está sendo feito nesse momento é traçar um paralelo que não existe. Para mim, não existe aqui a cronologia do golpe. Existe a coincidência maldita desses fatos. E uma pessoa que, infelizmente, deve ser desequilibrada, uma pessoa que, infelizmente, deve ter Assistindo filmes demais.

(Marco Feliciano) Há uma carta que o senhor Leonardo encontrou no celular dele. Eu termino aqui fazendo essa pergunta. O esboço daquela carta que é endereçado ao presidente Bolsonaro, foi entregue ao presidente Bolsonaro? Quando vasculharam e fizeram os apontamentos, esse esboço foi encaminhado para o celular do presidente Bolsonaro?

(Leonardo) Pelo menos esse esboço que estava no celular, não. Não sei se de outra forma isso pode ter sido entregue, mas o que consta nos autos, Não foi entregue.

(Marco Feliciano) Uma outra pergunta. Dentro desse celular que vocês pegaram, alguma mensagem foi encaminhada ao presidente Bolsonaro?

(Leonardo) Não.

(Marco Feliciano) Alguma mensagem foi encaminhada a alguma autoridade próxima ao presidente Bolsonaro?

(Leonardo) Na extração do celular dele consta ainda mais duas manifestações, mais ou menos nesse sentido, que ele teria enviado para o perfil de Instagram do Exército e de outras duas autoridades.

(Marco Feliciano) Mas celulares particulares, não?

(Leonardo) Não, enviou para o perfil de Instagram. Aquela mensagem que a gente manda para o perfil.

(Marco Feliciano) Para o Instagram em público. Eu tenho 3 milhões de seguidores...


(Leonardo) Não consta também no celular dele alguma resposta dessas autoridades a essas manifestações.

(Marco Feliciano) Então eu termino aqui dizendo que o meu pensamento ainda é esse. Não houve tentativa de golpe, houve essa coincidência maldita e que nós não podemos aqui praticar uma injustiça para tentar curar uma outra injustiça."
Oposição,Marcos Rogério,22 de jun.,https://www.instagram.com/reel/CtzeV4-rb76/,"Eu não faço blindagem a quem quer que seja. Mas é preciso separar o joio do trigo. Aqueles que cometeram crimes devem responder pelos seus atos. Agora, não podemos colocar todos na vala comum, igualando vândalos com o cidadão que protestava pacificamente.

#CPI8deJaneiro #MarcosRogério #SenadorMarcosRogério #Rondônia","<Parlamentar falando na CPMI>

Engana-se quem pensa que a minha atuação no âmbito dessa CPI vai ser no sentido de garantir blindagem a quem quer que seja. Meu intuito aqui é investigar, é esclarecer os fatos, é apresentar a verdade, esteja ela onde estiver. Mas narrativas não combinam.

No caso dos episódios do dia 8 de janeiro de invasão e depredação das sedes dos três poderes, somente podem ser responsabilizados os que praticaram efetivamente tais atos, os que contribuíram direta e conscientemente para a prática. E todos quantos cometeram crimes devem responder pelos crimes que os cometeram.

Agora é preciso separar joio de trigo. É preciso separar quem é criminoso de quem não é. Não se pode colocar na vala comum todos, porque nem todos são iguais. Muitos daqueles que foram constrangidos com prisões não são criminosos. São pessoas decentes, pessoas de família, pessoas que acreditam no Brasil e que lutavam por um ideal. E pelo fato de estar numa manifestação pacífica, não os torna criminosos. É a Constituição Federal que garante esse direito.

Então nós precisamos estabelecer aqui diferenças entre quem cometeu o crime e quem não cometeu. Quem invadiu as casas do Congresso, STF, Planalto. Depredou! Quebrou! É criminoso! Não vai ter meu apoio! Não vai ter minha defesa! Não espere de mim defesa! Não faço! Não vim pra defendê-los!
"
Oposição,Marco Feliciano,22 de jun.,https://www.instagram.com/reel/CtyyQF1MysN/,Direto da CPMI. 🇧🇷,"Olá, pessoal, cinco para as oirto e estamos aqui na CPMI que vai começar as 9. N'so estamos aqui para o enfrentamento. 

<Parlamentar aparece conversando com colegas com uma trilha sonora heróica>"
