Posição,Usuário,Data,Link,Legenda,Decupagem
Oposição,Flávio Bolsonaro,20 de jun.,https://www.instagram.com/tv/CtuwXKoJk9I/,"Por qual razão os acampamentos não foram desmobilizados antes do fatídico dia 8? 

Por que o ex-ministro do GSI de Lula, G. Dias, tratou os invasores com tanta educação e parcimônia? 

Vamos investigar cada omissão deste governo e cada obstáculo que foi colocado para atrapalhar as apurações!","<Parlamentar falando na CPMI>

O senhor veio com um discurso firme, com dados, dizendo quais são as suas fontes...

Sendo acusado de ter feito postagem em rede social, sendo acusado de estar buscando um emprego após a sua aposentadoria. São acusações gravíssimas.

E a partir daí a gente vê como seu depoimento foi sólido. Porque não tem como refutar.

Chegou alguns parlamentares aqui, de paraquedas, depois de várias horas de depoimento do senhor, que obviamente não estava ouvindo o que o senhor falou, e o acusaram de não cumprir decisão do STF. O senhor leu quinhentas vezes a sua determinação de cumprimento de decisões do STF, do TSE. O senhor cansou de dar dados técnicos, de fontes públicas, de que não houve nenhuma tentativa de dificultar a votação de ninguém, em especial no Nordeste. O senhor cansou de falar que não tem um registro de ocorrência, no Brasil inteiro, de alguém que não tenha conseguido votar por causa da atuação da PRF.

Só que ignoram completamente isso, porque o que vale é a narrativa, o senhor hoje desmontou a primeira narrativa, e eu quero dar os parabéns por isso, porque a própria narrativa de golpe, ela é fake em si, porque é o crime impossível.

É o crime impossível o golpe da forma como a narrativa tenta fazer com que parte da população creia.

Alguém em sã consciência acredita, senador Magno Malta, que vai ter algumas dezenas de pessoas que vão invadir o Palácio do Planalto, o Supremo e o Congresso, vão sentar na cadeira de presidente, vão dar ordem no Brasil inteiro e vai todo mundo cumprir?

Esse é o golpe. Esse é o golpe.

Ou o golpe do zap-zap? O dia 8 de janeiro, o presidente não era mais Bolsonaro.

A realidade se impõe às narrativas. Se houvesse tentativa de golpe, teria sido consumado com o presidente Bolsonaro na cadeira. No entanto, ele já estava fora do Brasil.

E digo mais. A extrema-esquerda gosta de usar outra narrativa, de que os acampamentos nas frentes de quartéis foram os embriões do golpe. Peraí, se tinham pessoas lá de alta periculosidade, pessoas armadas, por que no dia 2 de janeiro os acampamentos não foram desmobilizados? Por que no dia 3 de janeiro os acampamentos não foram desmobilizados?Por que no dia 4 de janeiro os acampamentos não foram desmobilizados? Por que no dia 5 de janeiro os acampamentos não foram desmobilizados? Por que no dia 6 de janeiro os acampamentos não foram desmobilizados? Por que no dia 7 de janeiro os acampamentos não foram desmobilizados?

E como é que chega um grupo de pessoas desarmadas e invadem o Palácio do Planalto, que tem um batalhão específico para proteger aquele patrimônio público?

Eu tenho 20 anos de vida pública, já vi diversas manifestações violentas da extrema-esquerda, com Black Blocks no Rio de Janeiro, em que o batalhão de choque - essa gravata aqui é uma homenagem a todos os batalhões de choque do nosso Brasil - conseguiam reprimir e evitar a depredação de patrimônio público de grupos muito menores.

Mas essa omissão, presidente Arthur Maia, nós vamos sim fazer questão de ir atrás aqui nessa comissão.

E esses vazamentos seletivos que acontecem - porque quando é vazamento que ajuda a narrativa, tá tudo ok é bem visto, não se instala um inquérito pra investigar nada. Agora, quando é o vazamento, por exemplo, do G Dias tratando os invasores com aguinha gelada, parcimônia e muita educação, aí é vazamento, vamos investigar quem foi que vazou.

E chega ao cúmulo da extrema-esquerda de defender que esse cidadão não seja convocado aqui. Quero dar os parabéns ao presidente da comissão, por ter conseguido retomar o bom senso da base governista da extrema-esquerda aqui, nessa comissão, de ceder, tem que ceder, para ouvir aquele que foi o maior pivô e, na prática, foi o que colocou essa comissão parlamentar de inquérito, mista de inquérito, para funcionar.

Pergunta do vazamento seletivo, agora está aí o vazamento seletivo, se não me engano foi à revista Veja.

Por que que vazou-se o material apreendido no celular do Tenente Coronel Cid, uma parte dele. ""Passo a passo para o golpe"", algo do tipo, ""passo a passo para o golpe"". E aí você vai ver o professor Yves Gandra fazendo manifestações públicas de que se tratava de uma resposta dele aos alunos do Exército Brasileiro, sobre a aplicação do artigo 142.

Quer dizer, golpe de Estado, com base na Constituição Federal? Golpe de Estado? Ataque à democracia? Se questionando qual é a aplicação do artigo 142 da Constituição Federal

E por que aqui nesse vazamento dessas mensagens, não aparecem os 'considerandos'? Porque, se há uma minuta de golpe, tem lá qual é a fundamentação jurídica da sua execução e os considerandos.

Por isso a minha curiosidade, presidente, de ter acesso à essas informações, porque eu to curioso para ver que considerandos são esses, quais eram os ataques à democracia que poderiam estar fundamentando uma minuta dessa? Repito, de 2017, portanto, nada a ver com o governo Bolsonaro.

Curioso, porque é que não se vazou essa parte também, já que é um material que, em tese, era para estar junto. Com muita tranquilidade aqui, porque se isso não for requerido, é requerido a Vossa Excelência que seja votada aqui nessa comissão.

E, por fim, o senador Magno Malta tratou de um assunto aqui e faltou ele falar uma outra parte. Porque há lampejo de lucidez nesse governo. Há lampejo de lucidez.

E é indefensável. Ai não é o Flávio Bolsonaro, não é a direita golpista que está falando, que foi essa entrevista publicada hoje do ministro Zé Mucio, ministro de Estado da Defesa do governo Lula, Opinião dele, aspas dele.

""Ato golpista não tem grande líder por trás""

""Ato golpista não tem grande líder por trás""

Diferente do discurso do governo. 

E outra falha marcante aqui. As pessoas que vieram para a Praça dos Três Poderes no dia 8 de janeiro não saíram dos acampamentos de Brasília. Foi gente de fora, estimulada por irresponsáveis baderneiros.

Que maluquice de golpe é esse? Golpe virtual?

A narrativa de golpe é fake. Por ela mesmo por ser um crime impossível.

Nós vamos sim buscar a real omissão do atual governo. Se tivesse colocado um aparato compatível, minimamente compatível, com as informações que todo os órgãos tinham, de inteligência, de segurança, já tinham previamente, pelo menos, desde 2 dias antes do dia 8 de janeiro, certamente nada disso tinha acontecido. Meia dúzia de bombas de gás lacrimogênio tinham resolvido o problema, Silvinei Vasques. E não foi o que nós vimos.

Dai importância de nós termos acesso, por exemplo, às imagens do Palácio do Planalto, para saber se antes do grosso dos manifestantes chegarem lá, já não tinha gente lá dentro, por acaso.

Palavras do ministro de Estado na defesa do Lula. ""Foi gente de fora, estimulada por irresponsáveis"".

Mias uma vez nós vamos chegar lá com os trabalhos dessa CPMI."
Oposição,Flávio Bolsonaro,20 de jun.,https://www.instagram.com/reel/Ctu8GshgMP_/,Golpe com base na Constituição Federal e nas tias do zap?!,"<Parlamentar falando na tribuna do Senado>

Mas só pra fazer um balanço muito rápido da minha satisfação do primeiro dia de CPMI, onde está sendo ouvido o ex-diretor-geral da Polícia Rodoviária Federal, Silvinei Vazquez, porque é uma oportunidade ímpar de combater a falsa narrativa, que a esquerda tenta impor ao Brasil, de golpe.

Onde a maior acusação contra o Vasquez, o senhor Vasquez, é uma postagem que ele fez em rede social durante a sua folga no final de semana, às vésperas da eleição. 

Então eu queria dar aqui de público os parabéns ao senhor Vasquez, porque já derrubou a primeira narrativa, no primeiro dia de CPI, de que a Polícia Rodoviária Federal pudesse ter sido usada para fins eleitorais no primeiro e no segundo turno das últimas eleições.

Aonde estão os fundamentos, que integram também esse suposto passo a passo de golpe, os 'considerandos', será que tem algum problema em se divulgar isso? Já que quando divulgam um vídeo que é favorável à narrativa do PT, ninguém liga pra nada, tá tudo bonito. Aí quando divulgam um vídeo que desmascara a narrativa do PT, como foi o vídeo do General G Dias, tratando com muita cordialidade, dando aguinha para os invasores, é considerado como vazamento, ai tem crime, ai tem abuso de autoridade.

Onde que estão os 'considerandos' desse suposto passo a passo para uma tentativa de golpe no nosso Brasil. Será que estão tentando esconder isso?

Então, presidente, eu vou requerer na CPMI que seja divulgada na íntegra essa parte do documento que está no armazenamento do celular do tenente-coronel Cid. Vamos ver quais seriam os motivos que estariam motivando. Será que tem alguém com preocupação de quais seriam as motivações de se dar publicidade a isso?

Algo que o próprio brilhante jurista Ives Gândara inclusive já fez referência, que seria um fato de 2017, uma tese defendida pelo então oficial Cid sobre a aplicação do artigo 142, que não tem absolutamente nada a ver com o que estamos investigando na CPMI.

Presidente, não adianta tentar calar o movimento que veio para ficar, tentar imputar todas as covardias, ao arrepio da lei, contra um presidente que venceu a maior crise sanitária que todos nós aqui em vida já vimos, com resultados excepcionais, elogiados pela ONU. O governo Bolsonaro elogiado pela ONU pela forma como conduziu a pandemia, os números da questão do emprego, o controle da inflação, todo o esforço que foi feito, sem escândalos de corrupção no governo. Isso deve doer o cotovelo de muita gente.
"
Oposição,Marcos Rogério,21 de jun.,https://www.instagram.com/p/Ctw3ndWu0ZR/,"A partir de hoje, passo a integrar a CPMI de 8 de janeiro. 

Atendi a um convite do senador Marcos do Val, que se afasta para tratamento de saúde. Agradeço a confiança do Podemos que cedeu a vaga do seu correligionário. 

Assumo a missão com a responsabilidade de cumprir a tarefa de investigar com equilíbrio, firmeza e seriedade, como sempre fiz onde atuei.

É um desafio novo, mas o compromisso é o mesmo: lutar por Rondônia e pelo Brasil na defesa da verdade, da liberdade e da justiça.

#CPMIde8dejaneiro #MarcosRogério #SenadorMarcosRogério #Rondônia",<Foto do parlamentar na CPMI>
Oposição,Marco Feliciano,21 de jun.,https://www.instagram.com/reel/CtwmPizNOFd/,"Sobre ontem na CPMI do dia 08. 

Minha solidariedade e respeito ao ex diretor da PRF, Silvinei Vasques que prestou depoimento ontem na CPMI. Sua coragem e ousadia em encarar os fatos sem medo da verdade, lhe é peculiar. 

Vamos avançando na busca de elucidar o que ocorreu naquela tarde. Estamos empenhados por isso e temos certeza de que a verdade prevalecerá.","<Imagens do deputado falando na CPMI. Abaixo uma tarja com o texto ""Ex-Diretor da PRF Silvinei Vasques: Um herói, um patriota!"">

(Marco Feliciano) Silvine, o senhor é muito bem-vindo à Casa do Povo.

(Marco Feliciano) Depois de 12 horas e 8 minutos aguardando, e fiquei aqui de propósito, porque essa foi a primeira oitiva da CPMI, e eu confesso que vim para cá meio atribulado, atormentado, com medo. Mas depois que eu vi a sua postura aqui nessa comissão, a sua tranquilidade, o seu testemunho de alguém que já enfrentou balas de fuzil, enfrentar aqui meia dúzia de bravatas e narrativas, o senhor saiu muito bem.

(Marco Feliciano) O senhor, para mim, é um herói. O senhor é um herói, é um patriota e é um brasileiro. E tem meu respeito e acredito que o respeito da maioria dos brasileiros que depois dessa CPMI, dessa oitiva, sabe que o senhor sai maior daqui do que quando chegou. Porque quando o senhor chegou, o senhor mesmo disse que não teve oportunidade de fala. E nós ouvimos falar aqui por 12 horas a fio.

(Marco Feliciano) Logo no início da nossa sessão, um deputado aqui falou erroneamente a palavra inquisição. E eu me lembro que o senador Amin ainda levantou e disse, inquisição não, inquirição. E eu comecei a me lembrar dos auros anos de teologia, e sabe o que eu me lembrei, Senadora Damares? Que inquirição e inquisição são muito parecidos. A diferença é que a inquisição é usada para condenar hereges. E o que é um herege? É aquele que não crê naquilo que o inquiridor ou inquisidor crê.

(Marco Feliciano) Então, como o senhor chegou aqui na qualidade de convidado e foi tratado como um convocado. Logo de início, foram duas horas de sabatina feita pela relatora, uma hora e vinte e oito minutos eu marquei aqui, apenas sobre assuntos extra, que não estavam na temática do requerimento. Alguém pode até dizer que talvez ela estava tentando traçar o seu perfil psicológico, que eu não acredito nisso. Talvez nem sei se há cognição por parte da pessoa para tratar isso.

(Marco Feliciano) Todavia, por uma hora e vinte e oito minutos, apontaram para o senhor todos os calibres possíveis. E depois, vinte e oito minutos apenas para falar sobre a temática. Poderíamos ter encerrado essa sessão há uma hora atrás. E o senhor se saiu muito bem.

(Marco Feliciano) Eu quero aqui então lhe dar os parabéns em nome de toda a população brasileira. O senhor respondeu a todas as perguntas. Eu tinha aqui quase 20 perguntas para fazer e não vou fazer nenhuma.

(Marco Feliciano) Em 2014, o PT teve, no Norte e Nordeste, 24 milhões e meio de votos. Em 2018, 24 milhões e 200 mil votos. E em 2022, 26 milhões e 300 mil votos. Dois milhões a mais. E aí vem aqui as pessoas dizer que o senhor atrapalhou a eleição deles lá para cima. 

(Marco Feliciano) Então eu termino aqui a minha fala só dizendo ao senhor como eu comecei, Sr. Silvinei. O senhor é para mim um herói. 

(Marco Feliciano)E eu vou deixar aqui para o senhor uma pergunta apenas. O senhor se sente como alguém que está sendo perseguido politicamente? E uma segunda pergunta, se o senhor quiser responder, fique à vontade. O senhor acredita que em 8 de janeiro houve uma tentativa de golpe de Estado no Brasil? E mais uma vez, obrigado pelo senhor ser brasileiro.

<Imagens de Silvinei Vasques respondendo na CPMI>

(Silvinei Vasques) Marcos Feliciano, a primeira pergunta é se eu me sinto perseguido, me sinto muito perseguido. Muito, muito, muito difícil. Tem que ter muita força para não pensar coisas ruins, porque é muito difícil a gente sair na rua, familiares sendo xingados na rua, recebendo ameaça. O Instagram eu tirei do ar, eu recebi milhares e milhares de ameaças.

(Silvinei Vasques) O meu nome foi colocado em grupos de hacker mundial. O nome, CPF, telefone, endereço, e-mail, tudo. Grupos de Portugal, da Romênia, Bulgária, e ficam me ameaçando em várias línguas, inclusive. Eu não ando em nenhum local. Eu tenho que estar sempre preocupado, porque eu estou com medo, realmente, de ser assassinado, ou pelo PCC, ou pelo Comando Vermelho, em razão de tudo isso que passou aí.

(Silvinei Vasques) A segunda [pergunta], em razão da advertência que eu levei pela manhã aqui, na condição de testemunha, eu não posso falar porque eu vou estar produzindo algum comentário pessoal e aí eu posso estar incorrendo o risco de sair de testemunha e passar para a acusada, então eu não posso responder."
Oposição,Marco Feliciano,21 de jun.,https://www.instagram.com/reel/CtxHyM6s313/,"Ainda na tentativa de esclarecer e entender o que aconteceu no dia 08 de janeiro. Impossível falar do ato, sem lembrar o que levou aqueles brasileiros á Brasília naquele domingo.","<Parlamentar falando durante a CPMI, em baio da imagem aparece uma tarja com o texto ""O Medo Cega!"">

Vou usar aqui apenas meu tempo para dizer que, aquele povo, que no dia 8 de janeiro foi maltratado, e entre eles, é claro, tivemos os vândalos, todos eles tinham um motivo.

O mesmo motivo deles foi o motivo que levou as pessoas a fazerem as barricadas pelo nosso país, e eu não concordo com o que foi feito. Mas o motivo, se resume a uma palavra: medo. O medo é um dos piores sentimentos que um ser humano pode ter na vida.

Eu sou um assíduo leitor da Bíblia e tem dois fatos na Bíblia, duas histórias sobre o medo que me deixam apavorado. Uma é quando, Moisés, enviou para uma certa terra 12 espias para observarem a terra e trazer a notícia para o povo. Dez espias voltaram contando que lá naquela terra tinham homens que eram tão grandes, tão altos, que eles se sentiam como um gafanhoto perto deles. O maior gafanhoto encontrado na história tem 25 centímetros. Então imagina que um gafanhoto, perto daqueles homens, era do tamanho da palma da mão de um homem adulto, mas o medo deles os fez enxergar como se os homens daquela terra tivessem sete, oito vezes maior de altura do que eles.

Me lembro de Jesus, que lá no jardim do Getsemani, quando percebeu a morte, percebeu a dor e a agonia, o seu lado humano ali transpareceu, e ele, num ato de agonia, ele olhou aos céus e falou com o Pai, dizendo, se for possível, passa de mim esse cálice.

Então o medo é uma arma muito grande.

Tentaram usar isso aqui com o Senhor. Logo que o Senhor chegou, o Senhor aqui sofreu uma ameaça velada de sair daqui preso. É essa a forma que as pessoas agem. Mas o senhor não esmoreceu, o senhor mostrou coragem.

Mas o medo que eu estou falando são daquelas pessoas que, como eu disse, estavam acompanhando uma eleição e, simplesmente, quando olhava o seu candidato sair nas ruas, eram milhões de pessoas atrás desse candidato. E o outro candidato não podia sair na rua porque, quando saía, era vaiado. E, para fazer qualquer tipo de comício, tinha que ser num local fechado com os números dados. Aí esse mesmo povo, que viu milhões de pessoas saírem pela rua, começou a perceber que, durante a campanha, o seu candidato começou a ser boicotado.

<A imagem muda pra manchetes de sites de notícias, com a foto de Lula>

Foi boicotado, por exemplo, quando ele não podia mais falar sobre ditadores da Nicarágua serem amigos do candidato que estava.

<Retornam as imagens do parlamentar na CPMI>

E aí vem o judiciário e interfere.

<Imagens de manchete do site JOTA>

De repente, ele não pode também falar sobre que o candidato opositor foi preso. Não pode citar isso porque ele também sofre sanções do judiciário.

<Retornam as imagens do parlamentar na CPMI>

Aí o exército, que havia recebido uma incumbência de analisar as urnas, emite uma nota dizendo que não conseguiu chegar a uma conclusão por causa da falta do código-fonte.

<Imagens de manchete do site GOV.BR>

Depois...

<Imagens de manchete do site Portal Brasiliense>

Milhares de inserções de rádio do presidente Jair Bolsonaro, que era candidato, não foram veiculadas.

<Imagens de manchete no site do STF>

Aí, de repente, no dia 18 de outubro, o ministro Barroso do STF liberou prefeituras e empresas concessionárias para oferecerem voluntariamente o serviço de transporte público de forma gratuita.

<Imagens do parlamentar na CPMI>

E aí, de repente, olha que interessante. Em 2014, o PT teve, no Norte e Nordeste, 24 milhões e meio de votos. Em 2018, 24 milhões e 200 mil votos. E em 2022, 26 milhões e 300 mil votos. Dois milhões a mais. 

Essas pessoas que fizeram essas barricadas estavam com medo do nosso país virar uma Venezuela. Porque nós ouvimos as histórias, e não apenas histórias, testemunhos. Eu estive lá em Roraima. Eu ouvi de venezuelanos falarem que o cachorrinho que eles tinham na casa tiveram que assar, cozinhar o cachorro para dar para os filhos comerem. Pessoas adultas que perderam 20, 30, 40 quilos num regime ditador.

E o Brasil inteiro acompanhando essas coisas, essas histórias pela internet. E de repente eles veem que o candidato deles, que tinha essa multidão de pessoas que o acompanhavam pelas ruas, ser perseguido politicamente e não poder exercer o seu direito de fazer uma campanha extremamente transparente, que não foi.

Então esse povo com medo, no dia 8 de janeiro, veio aqui pra frente da esplanada. Alguns foram vândalos, sim, mas nunca foram terroristas. Nem os vândalos eu chamo de terroristas. São vândalos, tem que ser tratado como vândalos. 

A outra grande maioria chamam-os de golpistas. Golpistas sem arma, golpistas sem tanque de guerra, golpistas sem apoio de nenhuma instituição internacional, golpistas com Bíblia na mão, golpistas com orações nos lábios, golpistas que cantavam o hino nacional vestindo roupa verde e amarela. Esses são os golpistas.

É lastimável chegar aqui nessa CPI e ver tudo isso. Eu espero que o Brasil esteja acompanhando. Em especial, o Estado do Maranhão esteja acompanhando para ver como é que as coisas estão sendo tratadas aqui. E essa foi só a primeira oitiva. Eu imagino que vem pela frente.

O senhor acredita que, em 8 de janeiro, houve uma tentativa de golpe de Estado no Brasil com 5 mil pessoas que estavam aqui na esplanada?

<Imagens de manchete do G1: Manifestação em Brasília tem 3 presos e mais de 120 feridos>

Digo isso porque, em 2017, colocaram 35 mil pessoas aqui, senador Magno Malta. Incendiaram o Itamaraty. E 35 mil pessoas não conseguiram chegar perto do Palácio do Planalto. Em 2013, 30 mil pessoas e não conseguiram chegar perto do Palácio do Planalto.

<Retornam as imagens do parlamentar)

Mas em 8 de janeiro, assim como que um passe de mágica, 5 mil pessoas conseguiram entrar no Palácio do Planalto, na Câmara dos Deputados, no Senado, no STF. Que façanha tinha esse povo. Mirabolante isso. 

Essa CPI era para isso, era para tratar desses assuntos e não para ter pessoas como o senhor aqui, que só fizeram o seu serviço.

E, mais uma vez, obrigado pelo senhor ser brasileiro.
"
Oposição,Eduardo Girão,22 de jun.,https://www.instagram.com/reel/CtzvPgWsTNf/,"🗣️A QUEM INTERESSAVA ESSA FRAUDE?🤷‍♂️

Vamos descobrir. Hoje pela manhã na CPI do DF, o ex-Ministro do GSI de Lul4, General Gonçalves Dias revelou ter alterado um documento da ABIN a respeito dos atos de 8/1; admitiu ter feito “ajuste”…

As revelações são gravíssimas! Todo mundo lembra que o Governo LUL4 não queria de jeito nenhum que o ex-Ministro fosse ouvido na CPMI no Congresso. Com muita mobilização de colegas da oposição e com o apoio irrestrito da sociedade, conseguimos reverter a decisão anterior e convocá-lo para prestar depoimento.

Vamos investigar a fundo, no limite de nossas forças para que TODA a Verdade apareça. 

Que a Verdade e a Justiça prevaleçam. Hoje e sempre! 
Jesus no comando. Sempre!
Paz & Bem 👍🇧🇷☀️🙏🏽

#senadoreduardogirão #éticanapolítica #pelobrasil #peloceará #justiçaparatodos #cpmi #pelobrasil","<Imagens do depoimento G. Dias na CPI dos Atos Antidemocráticos da câmara legislativa do DF. Ao seu lado o presidente da CPI, Deputado Chico Vigilante. O vídeo tem tarjas em cima e em baixo. Em cima diz ""General de Lul4 confessa que relatório da Abin foi' e continua em baixo em destaque 'ADULTERADO!'>

(G. Dias) Eu não adulterei e nem fraudei nenhum documento. Eu sempre falei no GSI, principalmente nessa semana, que todo documento que passasse por lá tinha que ser a expressão da verdade.

(G. Dias)A CCAI solicitou ao GSI o que a Abin tinha produzido de informação. Esse documento passou para a Abin. A Abin respondeu com um copilado de mensagens de aplicativo. Esse documento tinha lá, 'ministro do GSI'. Eu não participei de nenhum grupo de WhatsApp. Eu não participei do grupo. Eu não sou, na realidade, o difusor daquele copilado de mensagens.

(G. Dias) Então o documento não condizia com a verdade. Esse era UM documento. O documento foi acertado e enviado para a CCAI.

(Dep. Chico Vigilante) Essa informação que o senhor traz é muito grave, porque ela demonstra que um órgão de Estado, pelo que o senhor está dizendo, e eu acredito no que o senhor está falando, fraudou um documento, e aí precisa que as autoridades apurem a quem interessava essa fraude. Isso é grave, precisa que seja investigado. 

(Dep. Chico Vigilante) Essa fraude interessava quem? Quem era o diretor, presidente, acho que é isso, da Abin na época?

(G. Dias) Era o diretor, o diretor adjunto era o Saulo.

(Dep. Chico Vigilante) Ele é o responsável por isso?

(G. Dias) Ele é o responsável por produzir o documento. A Abin é a responsável por produzir o documento."
