Posição,Usuário,Data,Link,Legenda,Decupagem
Oposição,Eduardo Girão,13 de jun.,https://www.instagram.com/reel/CtcFCJYLt60/,"❌ENSAIO FOTOGRÁFICO NEGADO. BLINDAGEM AO GOV.FEDERAL ESCANCARADO NA CPMI📌

Eles perderam a vergonha e não escondem o S3QU3STR0 da Comissão mista parlamentar de inquérito sobre os atos do dia 8/1. 

Hoje tivemos vários requerimentos negados pela maioria que invadiu a Comissão para sabotar, boicotar uma investigação ampla que a sociedade anseia. Só para vc ter uma ideia, eu e outros Parlamentares, de diversos partidos, entramos com pedido para ouvir o jornalista flagrado em imagens das câmeras de segurança do Palácio do Planalto e que só vieram a público por conta do vazamento da cnnbrasil.

Se é uma “F4K3 N3WS” que o jornalista estava envolvido com os manifestantes ou teve permissão de “peixe graúdo”, por qual motivo o Governo Lul4 se esforça tanto na “cara dura” para que não o convoquemos?

Que a Verdade e a Justiça prevaleça. Deus no controle. De tudo! 
Paz & Bem 👍🇧🇷☀️🙏🏽

#senadoreduardogirão #pelobrasil #peloceará #justiçaparatodos #transparência #éticanapolítica #jesusnocomando #cpmi #fimdaimpunidade","<Parlamentar falando na CPMI. O vídeo vem com uma moldura em cima e em baixo. Em cima, um texto diz ""Por que o Gov. Lul4 não quer o depoimento do"" continuando em baixo ""fotógrafo da Reuters na CPMI de 8/1?"">

Eu quero deixar muito claro que voto todo tipo de requerimento, de um lado ou de outro. O seu encaminhamento eu vejo como perfeito aqui nessa sessão. Agora, a gente não pode jamais, por uma questão de coerência, de critérios que foram adotados, deixar de chamar o senhor Adriano Machado.

<Vídeo muda para cenas de câmera de Segurança no Palácio do Planalto no dia 8 de janeiro de 2023 (é possível ler a data no vídeo). Nela uma pessoa com camiseta amarela e usando a bandeira do Brasil como capa se aproxima de uma porta de vidro, seguida por um fotojornalista e outras pessoas com bandeiras do Brasil, e começa a chutar a porta de vidro. Tendo desbloqueado a porta ele e os outros entram na sala que estava fechada. Nela, o jornalista mostra a foto feita para o grupo. O fotógrafo sai da sala, mas logo o homem que chutava a porta corre atrás dele e pede para ver a foto novamente. Eles se cumprimentam amigavelmente e o fotógrafo sai de cena>

Eu queria reiterar o apelo feito por alguns colegas aqui, porque aquela cena é uma cena muito forte de um vazamento que houve, eu acho que essa CPMI aconteceu definitivamente por causa daquele vazamento, porque ela estava caminhando para um boicote, para uma sabotagem do governo Lula, quando começou a oferecer, segundo a imprensa, parlamentares denunciaram, dezenas de milhões de reais para parlamentares retirarem as assinaturas, assim como cargos federais também oferecidos.

E eu queria colocar para o senhor que aquele vazamento – e uma imagem chocante – é um fotógrafo de uma grande agência internacional, que também trabalha para empresas locais de comunicação, que pareceu uma encenação. Tipo assim, peraí, vamos ver, quebra agora. Não, faz de novo.

<Retornam as imagens do parlamentar falando na CPMI>

Então, a gente tem que dar o exemplo aqui, Sr. Presidente, de buscar a verdade. O que tiver que votar de Bolsonaro, você pode contar que eu voto. Agora, o que tiver de governo Lula, nós precisamos também votar, para ver, exatamente, buscar a verdade.

Eu acho que chegou a hora. Vai ficar feio uma comissão que foi ocupada, que é um instrumento da minoria, da oposição, e sinceramente vai ter blindagem aqui de quem veio ocupar? 60% dos colegas senadores não assinaram essa CPMI que é, repito, um instrumento da oposição, um instrumento legítimo da minoria.

Nós estamos querendo fazer um trabalho aprovando tudo, tudo, mas o governo não quer. Justamente o governo que se diz vítima, que sempre se disse que esses atos do dia 8, ele era vítima, ele nunca quis investigação. E está aqui a prova hoje, não quer a investigação.
"
Oposição,Flávio Bolsonaro,14 de jun.,https://www.instagram.com/reel/CtfWKX0gsUH/,"Deputado departhuroliveiramaia agiu com nobreza, pelo bem da Justiça e do equilíbrio na CPMI.
Agora iremos investigar de verdade o 8 de janeiro!","<Montagem mostrando tweets do presidente da CPMI Arthru Maia, com uma música tensa, mas empolgante,  de fundo>

<Nos tweets se lê: ""Foi constrangedor ver a maioria do colegiado da CPMI do 8 de janeiro rejeitar requerimentos de convocação de personagens centrais nessa investigação, como é o caso do GDias, ex-GSI, do Saulo Moura da Cunha, ex-Abin, e do Ministro da Justiça, Flávio Dino. Na próxima sessão, me comprometo a pautar os requerimentos representados e o farei quantas vezes forem necessárias. Espero que possamos aprovar todos os nomes, sem distinção, para garantir que todos sejam ouvidos a fim de que se chegue na verdade. Confio na consciência daqueles deputados que têm compromisso com a opinião pública e acredito que a gente consiga mudar essa realidade. É inaceitável ouvir apenas um lado""> "
Oposição,Eduardo Girão,14 de jun.,https://www.instagram.com/reel/CtfgOgmsKIB/,"🗣️C/A PALAVRA UM DOS MAIORES JURISTAS DO BRASIL✍️

Gratidão ao ilustre professor Dr ivesgandradasilvamartins - referência de ser humano, cristão e profissional renomado internacionalmente - pelas considerações sobre nosso posicionamento na CPMI do dia 8/1; CPI ou CPMI são instrumentos legítimos - e históricos - da oposição  e da MINORIA, não da máquina de um Governo de ocasião. 

Quando o Gov.LUL4 invade, sequestra deliberadamente essa comissão com a força bruta do poder pelo poder para fazer uma investigação seletiva é a instituição que perde, a democracia que é violada…

Após a quase “confissão de culpa” do Governo Federal com os seus parlamentares rejeitando os requerimentos da oposição ontem e com a enorme repercussão negativa na sociedade me traz um alento as mensagens públicas emitidas pelo Presidente da CPMI departhuroliveiramaia que vai rever os requerimentos rejeitados para que a Comissão seja minimamente imparcial. (Veja nos stories seus tweets). 

A oposição e os cidadãos do País que acompanham esse importante tema renovam a esperança no triunfo do bom senso e da Justiça a partir dessa postura correta do Deputado Presidente da CPMI, Arthur Maia, que se compromete a pautar quantas vezes sejam necessárias os Requerimentos rejeitados na última sessão na busca do equilíbrio das investigações para que as mesmas sejam ampla e irrestritas. 

Que a Verdade prevaleça em nossa Nação. Deus no controle. De tudo!
Paz & Bem 👍🇧🇷☀️🙏🏽

#senadoreduardogirão #pelobrasil #peloceará #justiçaparatodos #transparência #éticanapolítica #jesusnocomando #cpmi #8dejaneiro #fimdaimpunidade","<Yves Gandra Martins em um escritório, falando olhando diretamente para a câmera>

Assisti a manifestação do senador Girão na CPI do dia 8 de janeiro e realmente os argumentos que ele apresenta são extremamente ponderáveis. Pelo artigo 58, parágrafo terceiro da Constituição, a CPI é uma forma, se for de fato concreto, de o Congresso se manifestar, recebendo inclusive poderes semelhantes aos poderes do Poder Judiciário. E é um instrumento da oposição, porque é maneira da oposição fazer investigações maiores sobre o que o Executivo está praticando naquilo que a oposição evidentemente está divergindo.

Houve uma luta, como dizia o Senador Girão, para que essa CPI fosse aceita e que obterem assinaturas, deputados colocavam, o governo forçava para que essas assinaturas fossem retiradas e, por fim, houve um momento em que não era mais possível controlar porque o próprio povo queria saber porque toda omissão do governo federal não foi examinada até aquele momento, tanto pelo Poder Judiciário quanto pelo Poder Legislativo. 

Foi constituída a comissão. Por incrível que pareça, a relatora se negou a assinar o pedido de CPI, foi nomeada relatora de uma CPI que ela não queria e se negou a assinar, diz o senador Girão.

E por outro lado, a maioria dos que representam o Senado na CPI não quiseram assinar o pedido de CPI. Diz ele que evidentemente isso retira da oposição, que foi quem estava querendo saber a verdade verdadeira, a força dentro da CPI.

Mas o que mais tem preocupado é que todos os requerimentos que ele tem apresentado no sentido de que se ouçam aqueles que se omitiram a atuar naquele dia 8.

Porque o governo do estado de São Paulo teve as mesmas informações do governo federal no dia 6 de janeiro, que haveria esses movimentos. O que fez o secretário de justiça de São Paulo? reforçou a polícia militar em todos os pontos em que havia aglomeração de pessoas. O que fez o ministro da justiça do governo federal? Inclusive diminuiu a guarda, apesar da informação, do próprio palácio naquele tempo, naquele dia.

E mais do que isso, nós vimos os vídeos que só foram liberados depois de muita pressão junto à Suprema Corte, em que as autoridades andavam com a maior tranquilidade entre os chamados golpistas naquele período.

E diz o senador Girão, e isso é que eu acompanhei no seu depoimento, ele quer ouvir essas pessoas. Afinal de contas, por que essa omissão? Por que São Paulo tomou as providências e o governo federal não tomou? Por que o secretário de Justiça daqui garantiu a tranquilidade no governo do estado de São Paulo e o ministro da Justiça não garantiu lá no governo federal?

Para que nós, comuns mortais, nós que não somos cidadãos governamentais, que somos do povo, não temos nenhum cargo dentro do poder, é o que nós queremos saber. É o que o senador Girão tem procurado bater nesta CPI do dia 8, para que se conheça quem mandou praticar aqueles atos. Quais são os verdadeiros agressores do patrimônio público, aqueles que individualmente agrediram o patrimônio e por essa razão são aqueles que devem ser punidos? E quais são aqueles que se omitiram na defesa desse patrimônio, tendo, há mais de 48 horas, a informação que haveria aquele movimento?

Parece, a meu ver, sendo apenas um cidadão não governamental, um cidadão do povo, um cidadão que lê os acontecimentos e ouve os acontecimentos, eu também gostaria, bom, creio que os meus seguidores gostariam, de saber o que aconteceu com o depoimento de todos, dos que praticaram, dos que foram responsáveis e dos que se omitiram.
"
Oposição,Marcos Rogério,20 de jun.,https://www.instagram.com/p/Ctuosv0uqtd/,"Hoje, fiz questão de comparecer à CPMI de 8 de janeiro para acompanhar o andamento dos trabalhos. Ouvimos o depoimento do ex-diretor da Polícia Rodoviária Federal (PRF), Silvinei Vasques, sobre a atuação da PRF nas eleições. 

Apesar de não ser integrante, estou acompanhando os trabalhos e prestando apoio aos parlamentares da oposição. 

#Senado #SenadorMarcosRogério #MarcosRogério #Rondônia",<Foto do parlamentar na CPMI>
Oposição,Marco Feliciano,20 de jun.,https://www.instagram.com/p/CtuBLuSOoB1/,"Finalmente!

O requerimento de convocação foi aprovado pelos membros da CPMI. As tentativas do governo de blindar o general, parecem que fracassaram. Além de GDias, a CPMI aprovou ainda, a ida do coronel Jean Lawand Júnior, oficial do Exército; e Saulo Moura, ex-diretor da Abin. 

#CPMIdodia08 #depmarcofeliciano","<Imagem mostrando Lula e G. Dias abraçados>

<Em cima, o texto em letras vermelhas e amarelas: Finalmente! GDias finalmente é convocado para depor na CPMI do dia 08 de janeiro>

<em baixo, uma manchete da Revista Oeste: Convoca;áo de general Gonçalves Dias é aprovada na CPMI>

<No final do post uma assinatura do parlamentar, com sua foto olhando de forma altiva>"
Oposição,Marco Feliciano,20 de jun.,https://www.instagram.com/reel/CttsnnMOnhO/,Diretamente da CPMI do dia 8 de Janeiro.,"<Imagens da CPMI, mostrando vários parlamentares, com uma trilha sonora de suspense no piano>

<O texto ""CPMI do dia 8 de janeiro - 20/06/2024"" aparece em baixo da tela>

<O parlamentar aparece em conversas com parlamentares de oposição e governistas, e em entrevistas> "
Oposição,Eduardo Girão,20 de jun.,https://www.instagram.com/reel/Ctu_WkQx7yU/,"🎯GENERAL DO LUL4 CONVOCADO! Q VENHA TAMBÉM O FOTÓGRAFO DO PLANALTO E DESCUBRAMOS AS IMAGENS DO MJ…👀

Hoje a Verdade apareceu na CPMI. O depoimento do ex Diretor da Polícia Rodoviária Federal escancarou falácias do Gov. LUL4 que continua apavorado com as investigações do parlamento mesmo tendo maioria…

Seguirei cobrando as “imagens secretas” do Ministério da Justiça (o que tanto querem esconder da população) e a convocação do fotografo profissional da Reuters, flagrado em ENSAIO EXPLICITO do Palácio do Planalto, que só se tornaram de conhecimento público por conta do vazamento ocorrido na grande mídia. 

Tem coisa muito errada aí! O cidadão brasileiro quer, precisa e merece saber da verdade. 

Não defendo a blindagem de NINGUÉM! Dessa forma, quem errou que pague. Seja de direita, esquerda ou infiltrados…

Que a Justiça triunfe em nossa Nação. 
Jesus no comando. Sempre!
Paz & Bem 👍🇧🇷☀️🙏🏽

#senadoreduardogirão #éticanapolítica #pelobrasil #peloceará #justiçaparatodos #cpmi #deusnocontrole #vaidarcerto","<O vídeo inicia com imagens do presidente da CPMI, deputado Arthur Maia. Entretanto, o audio é da fala do parlamentar e, logo, a imagem se volta para ele. O vídeo tem uma moldura em cima e em baixo. Em cima diz 'Gov. Lul4: Narrativas derretendo', em baixo: 'dia de vitórias na CPMI'>

Eu procurei, desde o início, acompanhar essa – foi um dia atribuladíssimo aqui, várias coisas acontecendo ao mesmo tempo, como eu nunca tinha visto em quatro anos e meio – mas fiquei sempre ouvindo, acompanhando e eu quero fazer um apelo a todos os colegas, seja de diversas posições ideológicas, situação, oposição, a gente tem um dever moral, senhor presidente, de elevar o nível desse debate aqui.

A gente não pode fazer o que aconteceu hoje. O exemplo tem que vir de cima. Já não basta hoje a sociedade dividida que a gente está? Polarizada ainda, depois de uma eleição? Eu fico estarrecido em ver hoje aqui - oito horas estamos chegando de de inquirições, de oitiva- e a gente vê esse tempo, oito horas de falácia, de narrativa e até de fake news.

Ataques pessoais, de colegas contra colegas, rapaz, onde é que nós vamos parar com isso, pelo amor de Deus? É de um lado um dizendo que vai dar um tapa no outro, é o outro falando de colega que nem aqui tá, de SWAT, de não sei o quê. É outro que vai nas redes sociais acusar, dizer que tem que ver preso, que um fugiu do Brasil e que o outro que é colega nosso aqui vai ser preso, quer ver preso. Que sanha é essa, rapaz? Pelo amor de Deus. Esses são os democratas do Brasil que querem pacificar essa nação?

Cadê o Adriano Machado? Vou perguntar todo dia aqui. Vou usar o tempo para perguntar, porque não vai ... Nós não vamos escapar disso. Se a gente quer entregar a verdade para a população, é de todos os lados. Cadê o fotógrafo que estava lá no dia do dia 8 de janeiro? O requerimento dessa CPMI, que o governo – a gente tem que repetir isso – o governo não queria de jeito nenhum, o governo Lula o tempo inteiro sabotou, boicotou, e eu vi um colega parlamentar de sete mandatos, com todo respeito a quem pensa diferente, começando a sessão dizendo o seguinte, acredite se quiser, 'olha, o governo tem que fazer acontecer mesmo, tem que botar para votar, ganhar no voto, é a maioria que manda.'

Ora bolas. Foi sequestrado essa CPMI, rapaz. É um instrumento da oposição, da minoria, histórico, todo mundo sabe disso.

É como a gente diz lá no Nordeste, além da queda, o coice. Quer atropelar? Não vai chamar o Adriano Machado? Nós vamos colocar pra votar. Não é possível que querem cobrir as imagens do Ministério da Justiça, gente. O que é que tem de tão... de tão secreto nessas imagens que ninguém pode revelar do Ministério da Justiça?

A população quer saber isso. O dia 8.

Olha, eu quero dizer, Sr.Presidente, que eu participei de uma CPI aqui que Brasil todo parou no começo, acreditando que seria uma CPI séria. A gente não pode desgastar esse instrumento da democracia com narrativa, guerra de narrativa, o tempo todo.

Eu presenciei na CPI da pandemia e estou vendo uma CPI da pandemia 2. É isso que a gente quer? Não ir para lugar nenhum. Esse é o questionamento que eu queria fazer de coração para todos aqui.

Vamos nos respeitar. A regra da boa convivência é o respeito. Nós podemos ser adversários, sim, no campo das ideias. É um discordando do outro, querendo ganhar num argumento, mas jamais inimigos, rapaz. Nós somos irmãos, filhos do mesmo Deus.
"
Oposição,Flávio Bolsonaro,20 de jun.,https://www.instagram.com/reel/CttmxosgI-1/,Não vamos dar paz para o governo. Uma investigação séria não pode ignorar testemunhas-chave. Vamos conseguir a convocação do G. Dias.,"<Parlamentar dando entrevista para a TV Câmara. Em cima do vídeo aparece o texto ""CPMI que começa em pizza?> 

(Jornalista) O requerimento feito pela Senadora Elisiane Gama, o tema que está sendo investigado com relação a essa testemunha, qual é a expectativa de informações e esclarecimentos que isso realmente possa trazer para a CPI?

(Flávio Bolsonaro) Olha, por enquanto a expectativa é que não vai ter investigação, né? Porque foi uma coisa assim, descarada, eu nunca vi uma CPI começar desse jeito, né? 

(Flávio Bolsonaro) Falam que CPI termina em pizza. Você está começando em pizza a partir do momento que você não tem o mínimo de critério de se investigar, porque o que motivou, inclusive, deu força para que a CPMI fosse instalada, foram as imagens do ex-ministro do GSI, o general G. Dias, tratando com muito carinho, com muito amor, aqueles invasores que entraram no Palácio do Planalto e depredaram o patrimônio público.

(Flávio Bolsonaro) E aí quando a comissão vota para que ele não venha, é uma coisa assim que deixa o trabalho sem pé nem cabeça.  Eu acho que essa é a primeira coisa que nós temos que superar é fazer com que aquelas pessoas que são ali os pilares, que podem ter levado aos lamentáveis acontecimentos do dia 8, sejam ouvidas aqui na comissão, isso é o mínimo.

(Jornalista) A comissão tem 180 dias de prazo inicialmente. Essa decisão com relação à não convocação do general pode ser revista ao longo desse tempo?

(Flávio Bolsonaro) Eu acho que ela tem que ser revista, né? Porque está muito ruim para a sociedade esse comportamento da maioria dos membros efetivos da comissão de querer blindar o governo de uma forma descarada e, como eu disse, inviabilizar qualquer tipo de investigação.

(Flávio Bolsonaro) Se esse é o objetivo deles, eles estão atingindo, porque a conclusão não precisaria de 180 dias para concluir algo que eles estão proibindo, impedindo que seja investigado. Para que perder tanto tempo? Fecha e acaba logo hoje a CPMI."
Oposição,Marco Feliciano,20 de jun.,https://www.instagram.com/tv/CtuAX50hoAf/,CPMI de 08/01 - a Senadora tentou lacrar … mas quem lacra corre o risco de tomar invertida … e foi o que aconteceu.,"<Parlamentar falando de dentro de seu carro, não fica claro se esta dirigindo>

Pessoal, se aqui em Brasilia, onde começou todo o processo do 5G, que é a capital do país, a internet não funciona, imagina aí onde vocês estão.

Pois bem, como eu estava falando, eu acabei de sair aqui agora do Senado Federal, da CPMI do dia 8 de janeiro, vou dar um pulinho aqui no apartamento para eu pegar um documento e já volto.

Eu queria dar para vocês aqui um briefing do que aconteceu até agora, porque a CPI não terminou. Às duas horas a gente retorna, foram mais de três horas de uma tentativa de criminalizar o Sr. Silvio Silvinei.

Silvinei é o ex-diretor da Polícia Rodoviária Federal e a esquerda junto com toda a extrema imprensa tentaram rotulá-lo como alguém que tentou impedir as pessoas do Norte e do Nordeste votarem no presidente Lula no segundo turno das eleições, dia 30 de outubro.

A relatora, como eu disse desde o início, ela é tendenciosa e ela já escolheu um lado, então ela veio pra cima do senhor Silvinei de maneira indecorosa, de maneira deselegante, porque a proposta da CPMI é saber o que aconteceu no dia 8 de janeiro.

Aí ela fala que tem que haver uma cronologia, né? Então, na cronologia dela, tudo começou bem antes. Então, a cronologia, segundo ela, começou no dia 30 de outubro, que foi o dia da eleição do segundo turno. Até aí, tudo bem. Só que a relatora passou quase duas horas fazendo perguntas de cunho pessoal ao ex-presidente da polícia, ao ex-diretor da polícia rodoviária federal. Perguntou sobre os processos que ele tinha, perguntou sobre tudo que havia acontecido e ele, de maneira categórica, acabou mostrando pra ela que ele é um homem equilibrado, ilibado, um homem que tem responsabilidade, um grande brasileiro e um grande policial.

Ela passou 20 e poucos minutos fazendo questões apenas que de fato são a temática da oitiva aqui do dia 8 de janeiro sobre o que aconteceu do dia 30 pra frente. Ou seja, a senadora Elisiane Gama, na intenção de lacrar, ela acabou nos ajudando, porque ela mostrou pra nós quem é o policial. (Ironia) Um homem extremamente preparado, um patriota, que o único crime que cometeu foi apoiar o presidente Jair Messias Bolsonaro e ter postado isso em mídia social.

Esse é o Brasil que estamos vivendo.

Daqui a pouco nós vamos continuar a oitiva e eu devo fazer algumas perguntas pra ele. Aliás, as minhas perguntas eu até rasguei, porque tudo que eu ia perguntar ela já falou. Então quando chegar no meu momento de falar, se me derem a fala, porque nós estamos com tempo corrido aqui, eu acredito que vou ter tempo de fala, eu vou fazer as minhas considerações falando pra senadora Elisiane, que se ela ir por esse caminho em todas as oitivas, ela simplesmente vai assinar embaixo de tudo que nós estamos falando, que ela tem um lado, ela é governista e ela quer criminalizar o presidente Jair Messias Bolsonaro, os seus apoiadores e continuar com a velha narrativa de que houve uma tentativa de golpe aqui no país.

Muito obrigado a todos, Deus abençoe vocês, tamo juntos, um abraço.
"
